0,Text,User,User ID,Description,Location
2183,What will the midterms mean for President Trump? @dlippman of @Politco evaluates the next two years. #news\xe2\x80\xa6 https://t.co/r4leWeg0Jo,This Morning,43381418,"America's First News hosted by @GordonDeal, and powered by @CompassMediaNet . Tweets by @RadioGavin1 and @DDuncradio",
2184,"Well #Trump is doubling down with his speech about the ""midtown"" and #midterm election. The hostility continues",AnnCSloan,820303909725929473,Screenwriter/Producer/Editor Alumna of the 2017 Black List Screenwriting Lab. Creator of the podcast: The Carlotta Beautox Chronicles (coming in 2019).,Los Angeles
2185,"RT @amberlym: \xe2\x80\x9cA mass rejection of corruption, hatred, and bigotry should not be so hard to achieve, but historically it always has been an\xe2\x80\xa6",impeachSpanky,51565021,"Democrat. I believe in facts, gun-control, science, women's rights, LGBTQ rights, equality, education, BLM, & healthcare 4 everyone. #TheResistance #NeverAgain",Arizona 
2186,"RT @amberlym: \xe2\x80\x9cA mass rejection of corruption, hatred, and bigotry should not be so hard to achieve, but historically it always has been an\xe2\x80\xa6",Rob \xf0\x9f\x90\x9f \xf0\x9f\x8c\x8a \xf0\x9f\x92\x99 \xe2\x93\x8b #resist,19225446,"Therefore is judgment far from us, neither doth justice overtake us: we wait for light, but behold obscurity; for brightness, but we walk in darkness.","Brockton, Ross Ice Shelf"
2187,RT @nizmycuba: No surprise Dem Party\xe2\x80\x99s been the real Racist Party: \n\xe2\x80\x9cI know they all look alike\xe2\x80\x9d HRC jokes ornery abt blacks &amp; MSM finds it\xe2\x80\xa6,MsLillie MAGA,951870435825565696,"Patriotic Nationalist, MARRIED, conservative American #truth, #justice, #AmericaFirst \xf0\x9f\x9a\x82\xf0\x9f\x87\xba\xf0\x9f\x87\xb8\xf0\x9f\x92\xa8 #PresidentTrump #SuperElite #KAG2020 #MakeCAGolden \xf0\x9f\x8d\x8aNO Dating","Orange County, CA \xf0\x9f\x8d\x8a"
2188,RT @HeatherZuma: See you @FoxBusiness @TeamCavuto 12PM after @POTUS #Midterm #markets https://t.co/JB5U9hSt5z,Al-de-plumber. it\xe2\x80\x99s the Plumber,921030055085641728,"#MAGA #KAG. FB,@DianeBlackTN @JanMorgan_ @GeneMcVay @RealDrGina @charliekirk11 @scottisbell_ @atensnut @njvagone","Pennsylvania, USA"
2189,"So... do some of the #midterm results, specifically where red lost, mean that not enough #republicans voted, or are\xe2\x80\xa6 https://t.co/nScnKI9s9H",CT Townsend,19877736,"Christian, Husband, Father, Son! Evangelist/Preacher/Singer/Songwriter/. Passionate about Preaching & Reaching out to people with the Gospel of Jesus Christ!","Anderson, SC"
2190,RT @bitcoinagile: #bitcoin may be an unlikely winner in midterm elections #winner #midterm #elections #NotGoingToZero https://t.co/MpM5JNAk\xe2\x80\xa6,Milan van Eijk,988499675027267584,Freelance Designer | Creative Marketing | Rebel Visionary | Crypto Artist,Amsterdam
2191,RT @HeatherZuma: See you @FoxBusiness @TeamCavuto 12PM after @POTUS #Midterm #markets https://t.co/JB5U9hSt5z,M.Bianchi \xf0\x9f\x87\xba\xf0\x9f\x87\xb8,1053706473342189568,,"New York, NY"
2192,#bitcoin may be an unlikely winner in midterm elections #winner #midterm #elections #NotGoingToZero\xe2\x80\xa6 https://t.co/QoQsu0lpsu,BitcoinAgile,2281314234,"Breaking News: Bitcoin, Blockchain & Beyond #bitcoin #blockchain #ethereum #cryptocurrency #VC #crypto #trading #TA #charts #ico #altcoins $btc $eth",Matter Doesn't Matter
2193,Huh. I would\xe2\x80\x99ve gone with voter fraud. Interesting. #elections #midterm https://t.co/v4EOeQj8wS,MONTANA JOHN,593897228,"This is my Twitter account. There are many like it, but this one is mine.","Bozeman, MT"
2194,Huh. I would\xe2\x80\x99ve gone with voter fraud. Interesting. #elections #midterm https://t.co/v4EOeQj8wS,MONTANA JOHN,593897228,"This is my Twitter account. There are many like it, but this one is mine.","Bozeman, MT"
2195,"RT @WValderrama: \xf0\x9f\x87\xba\xf0\x9f\x87\xb8Two Native American women, a Somali refugee &amp; the first openly gay man elected governor, Texas sends the first 2 Hispani\xe2\x80\xa6",laur | 8\xf0\x9f\x96\xa4,809136520124694528,"\xe2\x80\x94\xe2\x80\x94 \xf0\x9d\x91\x9f\xf0\x9d\x91\x92\xf0\x9d\x91\xa0\xf0\x9d\x91\x9d\xf0\x9d\x91\x92\xf0\x9d\x91\x90\xf0\x9d\x91\xa1 \xf0\x9d\x91\x93\xf0\x9d\x91\x9c\xf0\x9d\x91\x9f \xf0\x9d\x91\x9a\xf0\x9d\x91\xa6 \xf0\x9d\x91\xa1\xf0\x9d\x91\x96\xf0\x9d\x91\x9a\xf0\x9d\x91\x92, \xf0\x9d\x91\x9f\xf0\x9d\x91\x92\xf0\x9d\x91\xa0\xf0\x9d\x91\x9d\xf0\x9d\x91\x92\xf0\x9d\x91\x90\xf0\x9d\x91\xa1 \xf0\x9d\x91\x93\xf0\x9d\x91\x9c\xf0\x9d\x91\x9f \xf0\x9d\x91\x9a\xf0\x9d\x91\xa6 \xf0\x9d\x91\xa0\xf0\x9d\x91\x9d\xf0\x9d\x91\x8e\xf0\x9d\x91\x90\xf0\x9d\x91\x92, \xf0\x9d\x91\x9f\xf0\x9d\x91\x92\xf0\x9d\x91\xa0\xf0\x9d\x91\x9d\xf0\x9d\x91\x92\xf0\x9d\x91\x90\xf0\x9d\x91\xa1 \xf0\x9d\x91\x93\xf0\x9d\x91\x9c\xf0\x9d\x91\x9f \xf0\x9d\x91\x9a\xf0\x9d\x91\xa6 \xf0\x9d\x91\x92\xf0\x9d\x91\x9b\xf0\x9d\x91\x92\xf0\x9d\x91\x9f\xf0\x9d\x91\x94\xf0\x9d\x91\xa6",
2196,RT @HeatherZuma: See you @FoxBusiness @TeamCavuto 12PM after @POTUS #Midterm #markets https://t.co/JB5U9hSt5z,Robert Henderson,823293471184318472,18yr Phily doorman now recently promoted to afternoon desk man in a high rise condo.Part time working for Uber on the https://t.co/7ABIt5s7GJ sports and Fox Bus,"Philadelphia, PA"
2197,See you @FoxBusiness @TeamCavuto 12PM after @POTUS #Midterm #markets https://t.co/JB5U9hSt5z,Heather Zumarraga,1689925255,VP Vision 4 Fund Distributors. Economic Policy & Financial Analyst. Canine Lover. Discuss #economy #markets #money on TV (tweets are my own.),"Washington, DC"
2198,"RT @WValderrama: \xf0\x9f\x87\xba\xf0\x9f\x87\xb8Two Native American women, a Somali refugee &amp; the first openly gay man elected governor, Texas sends the first 2 Hispani\xe2\x80\xa6",Aline  Uriarte,998335731348197376,Demi Lovato Queen!! Love You So Much!!,"Arma\xc3\xa7\xc3\xa3o dos B\xc3\xbazios, Brasil"
2199,My latest cartoon. #MidTerm #MidTermElections2018 #Election #Republican #Democrat #EditorialCartoon https://t.co/QptCn5JhFf,Randy Bish,24938881,Editorial Cartoonist. Slinging ink for over 30 years.,"Pittsburgh/Greensburg, Pa"
2200,"RT @JamieJBartlett: In amongst the #midterm madness, San Francisco voters passed \xe2\x80\x98Proposition C\xe2\x80\x99 - a 0.5% tax on big local businesses to fu\xe2\x80\xa6",code-for-PDX,990708696610103296,A Code for America Brigade focused on using technology to improve the lives of the people of Portland.,"Portland, Oregon"
2201,LIVE #ElectionResults2018 : #Trump speaks about #midterm election results van business #Democrats #Republicans https://t.co/t6zBxq05Oo,Richard Grune,2737254358,van alle markten ( niet ) thuis !,
2202,"RT @PeterHuvos: #Midterm #elections: congratulations to the newly elected (or reelected) members of Congress, may they not forget Austin Ti\xe2\x80\xa6",Scully,38700746,,Armagh
2203,Here\xe2\x80\x99s what you need to know about the #Midterm results https://t.co/utVAWiTiOB,Andrew Russell,91042095,National online journalist with https://t.co/xhPp6wcZi2 (@globalnews) Send me a message at andrew.russell@globalnews.ca,"Toronto, Canada"
2204,How the U.S. #midterm results might #impact Canadians https://t.co/N4m9lYvtnw.,ACLRC,2891059843,Promoting respect for and raising awareness about important human rights and civil liberties issues happening in the world around you.,University of Calgary  
2205,In his #foreign #policy #Trump will be played out given the reality of these #midterm results.\n\nHe's weakened enoug\xe2\x80\xa6 https://t.co/Ci7PJlPvl2,Peter Schotanus,2727494199,Family comes first. Geopolitics. History. JFK. Stones fan. Masters from UOL. Intolerant to boredom. Israel critic. Indifference and Ignorance are a threat.,
2206,RT @CGTNOfficial: Live: The United States is holding its #midterm #elections. Join CGTN for the latest updates. #US https://t.co/f2xwvyouNO,Nicolyn Montealto,1056174696029413377,To be yourself in a world that is constantly trying to make you something else is the greatest accomplishment.\xe2\x80\x9d,Cebu City Philippines
2207,Reasons to Celebrate the #Midterm results: 4 #PhenomenalWomen made History in the Elections yesterday. #Congress\xe2\x80\xa6 https://t.co/xqJkRhmDyY,hiphopucit,17313956,"M.A. | Owner of Hip Hop U-C-IT, LLC. & EIC of https://t.co/JM4OIVnu4L | #HHUCIT Mag | @AshleYYYMusic | @CultureShoes | @MrsAIYANA | Man of A\xce\xa6A | CHI | WI | ATL",Chicago | WI. | Midwest \xe2\x9c\x88ATL
2208,RT @MariaTeresa1: Latinas winning &amp; making history:\n\nHeading to Governorship \n@RepLujanGrisham \n\nHeading To Congress:\n@Ocasio2018 \n@vgescob\xe2\x80\xa6,Ruben Arias,262823814,"Student, Sports Journalist",
2209,#Midterm : A record number of women were elected to the House of Representatives in Tuesday\xe2\x80\xa6 https://t.co/JML4C4kGCI,Practical World,59410841,Practical World True News Mag by American Road Radio\xf0\x9f\x98\xa4,Los Angeles
2210,"RT @abc7anabel: #Election2018 UPDATE: With nearly 100% of precincts reporting in LA County, about 38% of registered voters turned out for t\xe2\x80\xa6",Jose Perez,1032544035301285890,,
2211,Breaking Fake News! #midterm #Midterm2018 #realDonaldTrump resigned as #President #chocolate,Fratzengeballer,1055538081066033152,Overweight transgender #no discrimination,Deeepuppyooasss
2212,RT @ChinaDaily: Americans across the country turned out in large numbers on Tuesday to #vote in a highly anticipated #midterm #election see\xe2\x80\xa6,Bobbyrei,440804516,#1moreminute,China
2213,".@BennieGThompson expected to re-take chairmanship of House #HomelandSecurity committee after #midterm win, Thompso\xe2\x80\xa6 https://t.co/5Aznj1cVhx",Michaela Ross,1620720727,"@BGOV Bloomberg Government reporter covering @DHSgov | @BloombergLaw, @MONEY, @PeaceCorps, @newmarkjschool, @carthagecollege Alum | Retweets \xe2\x89\xa0 Endorsements","District of Columbia, USA"
2214,"RT @StateStreetETFs: Historically, markets have performed well around #midterm elections. Could this year be an outlier? Chief Investment S\xe2\x80\xa6",Amoga\xf0\x9f\x8f\x80\xf0\x9f\x87\xba\xf0\x9f\x87\xb8,1049669107346563073,"new Account, let me explain it to you","Washington, DC"
2215,@bennyjohnson So much was accomplished in the #Midterm elections. #RedWave,\xf0\x9f\x8d\x81\xf0\x9f\xa5\x80 Julie Truth  \xf0\x9f\xa6\x85\xf0\x9f\x87\xba\xf0\x9f\x87\xb8\xf0\x9f\xa5\x80\xf0\x9f\x8d\x82,997298081023410176,"Love God, My Family and My Country. \xf0\x9f\x87\xba\xf0\x9f\x87\xb8.. It\xe2\x80\x99s all about the #Truth the whole Truth and nothing but the Truth. #BeBest",
2216,"Congratulations to @IlhanMN on becoming the first Muslim women in Congress, along with @RashidaTlaib\xe2\x80\xa6 https://t.co/KkXhknsgme",Shivan Fazil,158318405,@CheveningFco Scholar - Graduate Student in Middle East Politics @SOAS. Leadership Fellow Alumni @EastWestCenter. Formerly @Oxfam & @MERI_info,"London, England"
2217,#Midterm losses for @clairecmc and @SenatorHeitkamp means #Dem leadership on the Senate's #HomelandSecurity Committ\xe2\x80\xa6 https://t.co/oZaksRMbst,Michaela Ross,1620720727,"@BGOV Bloomberg Government reporter covering @DHSgov | @BloombergLaw, @MONEY, @PeaceCorps, @newmarkjschool, @carthagecollege Alum | Retweets \xe2\x89\xa0 Endorsements","District of Columbia, USA"
2218,RT @richeis315: The #midterm elections: Here's the verdict on what they mean for #Medicare #Medicaid #SocialSecurity and #drugprices https:\xe2\x80\xa6,Longevity Colorado,839318510153129985,News about longevity in Colorado & beyond. #Colorado #Longevity #Aging #Boomer Visit https://t.co/boS46Z0hIW contact: Katrin Olson,"Denver, CO"
2219,"RT @PeterHuvos: #Midterm #elections: congratulations to the newly elected (or reelected) members of Congress, may they not forget Austin Ti\xe2\x80\xa6",nico72om,944212070,"#HumanRights #antiraciste, aime l'humanitaire. #FreeRaif",world 
2220,WATCH LIVE: President #Trump Post-Election #Press_Conference on #Midterm Elections Result at the White House\n\nhttps://t.co/4Q0C6YMToN,Bob Diamond RPh,14907290,"#Pharmacist, Stock Trader, #Vietnam_Vet, #Mensa_Member -- #Christian #Patriot #COSProject #MAGA","Charlotte, NC USA"
2221,How wonderful it is to wake up to this&gt;&gt;  A record 100 #women elected to the House; An estimated 114 million voters\xe2\x80\xa6 https://t.co/hhz1gEDrA7,Dee Kayalar,108748432,"a lucky mom and wife \xe2\x99\xa1 life & career coach  \xe2\x99\xa1 connects, gives, cares @USDCareers \xe2\x99\xa1 #IUAlum \xe2\x99\xa1 multicultural \xe2\x99\xa1 Francophile \xe2\x99\xa1 cheesecake maker \xe2\x99\xa1 dog mom","San Diego, CA"
2222,RT @ChinaDaily: Americans across the country turned out in large numbers on Tuesday to #vote in a highly anticipated #midterm #election see\xe2\x80\xa6,Ram\xc3\xb3n Cort\xc3\xa9s,94125598,ciudadano m\xc3\xa9xico representaci\xc3\xb3n pol\xc3\xadtica tributaria democracia estado derecho leyes impuestos parlamento izquierda,RC09RC15
2223,RT @xruiztru: \xf0\x9f\xa4\x94 So Trump or Obama\xe2\x80\x99s success?\n\nUnemployment rate has been dropping for 9 years. #MidtermElection2018 #Midterm https://t.co/t\xe2\x80\xa6,Lucas Cardoso,393579314,,
2224,"Tuesday: \xe2\x80\x9cEveryone get out and vote, we all have a voice!\xe2\x80\x9d\nWednesday: \xe2\x80\x9cI meant vote like me, moron.\xe2\x80\x9d\nEvery time.  #midterm",Patrick Alexander,15908936,Hello? Is this thing on?,"Alabama, USA"
2225,"RT @amberlym: \xe2\x80\x9cA mass rejection of corruption, hatred, and bigotry should not be so hard to achieve, but historically it always has been an\xe2\x80\xa6",Finbarr Callan,60805938,,UK
2226,"#Midterm elections sets #record for #women in #Congress with at least 111 winning. Putting it in perspective, that\xe2\x80\xa6 https://t.co/Z89frUksYZ",Jodi Xu Klein,10970632,"US Biz Correspondent @SCMPnews. Follow the money btwn the US and #China and #TradeWars. Ex @Business, @WSJ, @TIME. jodi.klein@scmp.com",New York City
2227,RT @SCMPNews: These candidates made history at the 2018 US #midterm elections https://t.co/4f6wYEvvwb #ElectionNight,JACook,223937003,Never stop learning. I'm a doctor!,A'nowara
2228,RT @ChuckCallesto: WATCH: #CNN\xe2\x80\x99s Jake Tapper Laments #Midterm Results...\n\n\xe2\x80\x9cThis Is NOT a blue wave\xe2\x80\x9d.....\n\nhttps://t.co/NkAztmFwE0,Free \xf0\x9f\x92\xa3 Thinker,730772025061433344,"Free thinking is a super power.\nNot allowing others to manipulate your emotions, is a super power! As more and more Democrats walk away, life gets better!",United States
2229,Americans across the country turned out in large numbers on Tuesday to #vote in a highly anticipated #midterm\xe2\x80\xa6 https://t.co/337owfspb9,China Daily,87775422,Inspiring constructive dialogue between China and the US. Join the conversation!,New York City
2230,Thank you @NancyPelosi for being a smart #Democratic leader. I mean that. I\xe2\x80\x99m tired of months/years of hearing her\xe2\x80\xa6 https://t.co/X6J0uj2ezs,Paula Why Why Why,79819103,"YOU MAY SEE A STRANGER, debut linked stories (TriQuarterly Books @NorthwesternUP, 2016). 2017 Towson Prize for Literature. Editor @scoundreltime","Washington, DC"
2231,Thankful for the #midterm market bump! Anyone? https://t.co/6WV3WvqREg,Carolyn Bolton,555357209,"Yankee. Identical twin. Carpe diem. Retweets \xe2\x89\xa0 endorsements. Opinions mine. Formerly @sbnpnews, @WashTimes, @NJC_YAF, @The_Cabinet Views don\xe2\x80\x99t fit neatly in \xf0\x9f\x93\xa6","Washington, DC via RI, PA, CA"
2232,The Nov. 6 elections are done and the votes are in.\n\nRead all about the #MidTerm elections and here:\xe2\x80\xa6 https://t.co/62pZgLthZ2,Burleson Star,323394995,"The official Burleson Star Twitter account with news, updates and headlines from Burleson.","Burleson, TX"
2233,"RT @WValderrama: \xf0\x9f\x87\xba\xf0\x9f\x87\xb8Two Native American women, a Somali refugee &amp; the first openly gay man elected governor, Texas sends the first 2 Hispani\xe2\x80\xa6",Sal,393771210,Student at CSUN because Hogwarts didn't take FAFSA.\xf0\x9f\x8e\x97 SC: sal_villalobos // IG: sal_the_13oss Idol: @jtimberlake Bae: @jlo,
2234,US #midterm #elections 2018: What do the results mean for @realDonaldTrump? https://t.co/s83tQefqLt https://t.co/RAej3svICZ,NewsInn,3558044462,"An Artificial Intelligence Application created for aggregating, processing and delivering the news in an easy-to-understand fashion",
2235,"Abrams, Walker among key #candidates in #midterm #races refusing to concede https://t.co/xFyNDhFaUb https://t.co/e5iZaSv1x2",NewsInn,3558044462,"An Artificial Intelligence Application created for aggregating, processing and delivering the news in an easy-to-understand fashion",
2236,RT @ItsForexTime: #MidTerm takeaways:\n&gt; #Stockmarkets are trending higher \xf0\x9f\x93\x88\n&gt; \xf0\x9f\x87\xbf\xf0\x9f\x87\xa6 $Rand gains over 1% \n&gt; Acceleration in near-term $USD weak\xe2\x80\xa6,Ama Chibuike Daniel,415112953,Lyf's Beautiful Wit God,Owerri Nigeria
2237,Democrats took the House of Representative. Republicans held the Senate. What should #investors expect from the US\xe2\x80\xa6 https://t.co/st7SmgxHN0,Bernstein,786192157069586434,"Bernstein deploys a comprehensive range of investment strategies, cutting-edge investment planning & risk-management services to help clients reach their goals.",
2238,RT @ChuckCallesto: WATCH: #CNN\xe2\x80\x99s Jake Tapper Laments #Midterm Results...\n\n\xe2\x80\x9cThis Is NOT a blue wave\xe2\x80\x9d.....\n\nhttps://t.co/NkAztmFwE0,Marvin Russo,2759318762,,
2239,"RT @JamieJBartlett: In amongst the #midterm madness, San Francisco voters passed \xe2\x80\x98Proposition C\xe2\x80\x99 - a 0.5% tax on big local businesses to fu\xe2\x80\xa6",Emil Medellin,785371303,,Los Angeles
2240,"So, what\xe2\x80\x99s the damage from the election?\n\n#election #midterm",Mike Glendinning,82704394,Click the link below to hear this weeks podcast. We talk about horror movies and creepy songs.,"Albany, CA"
2241,#ICYMI @cunninghamjeff says CEOs entering the political fray - for #midterm elections or otherwise - are playing a\xe2\x80\xa6 https://t.co/e6OSTYQMbJ,Chief Executive,80619566,"Your number one source for news, analysis, competitive intelligence, trends and data for business leaders from Chief Executive magazine","Stamford, CT"
2242,Here are the stock markets potential winners and losers from last night\xe2\x80\x99s midterm election results -\xe2\x80\xa6 https://t.co/A11ubVVbWz,Sunwise Capital,65536603,A New Approach to Small Business Loans. Based on your Cash Flow because there's more to your business than a credit score. Follow us & let us help.,USA
2243,Read all about the #MidTerm elections here: \n\nhttps://t.co/C7gOKsMlCw,Burleson Star,323394995,"The official Burleson Star Twitter account with news, updates and headlines from Burleson.","Burleson, TX"
2244,"Best chance of being nonexistent in a year, Taco Bueno or Beto O\xe2\x80\x99Rourke?  #BetoForTexas #lol #Trump2020 #Bankrupt\xe2\x80\xa6 https://t.co/csPGu8RJD5",DDMcVay,1447339326,"Attorney by trade, survivorman during the off season. Redneck by default. It's who I am.","Enid, America"
2245,#MidTerm takeaways:\n&gt; #Stockmarkets are trending higher \xf0\x9f\x93\x88\n&gt; \xf0\x9f\x87\xbf\xf0\x9f\x87\xa6 $Rand gains over 1% \n&gt; Acceleration in near-term\xe2\x80\xa6 https://t.co/P48hd63OfL,ForexTime - FXTM,1361424438,"Official Twitter page of FXTM. Follow us for the latest news, forex promotions, market updates, & events. #ItsForexTime  \nhttps://t.co/T1SnGkOtQi",
2246,"@WhenWeAllVote I voted, for the FIRST TIME, in a #midterm election EVER.\nDonald Trump, was on MY ballot.\n#VA07\xe2\x80\xa6 https://t.co/kG2hXtCCyb",Jennifer Coleman,2218000892,Army Veteran. Golf fan. History buff.  Scorpio.,"Virginia, USA"
2247,RT @MariaTeresa1: Latinas winning &amp; making history:\n\nHeading to Governorship \n@RepLujanGrisham \n\nHeading To Congress:\n@Ocasio2018 \n@vgescob\xe2\x80\xa6,Asher Baumrin,809267326105305089,Aide for @bradhoylman | Formerly @UChicago philosophy | rt \xe2\x89\xa0 anything | Challenge me to a game of chess | He/Him/His |,"Manhattan, NY"
2248,RT @RobertCahaly: I'm so proud of the of the entire @trafalgar_group team tonight. We alone predicted @RonDeSantisFL #FLgov winner!! #Midte\xe2\x80\xa6,rtms77,12705982,"Enjoy historical fiction, Star Trek,Movies and TV, Canadian,",Canada
2249,RT @JennaLeeUSA: Why do we even have #Midterm #Elections? Here's the backstory about why the House of Representatives is elected every 2 ye\xe2\x80\xa6,Philip,1037734000268210176,"I live in Vista,CA. Love my family and friends!","Vista, CA"
2250,"Claudia Schmucker: #Midterm results will lead to more punitive #tariffs, and likely stoke trade war with #China. Th\xe2\x80\xa6 https://t.co/w2mkuMOb1H",DGAP,19703474,DGAP Deutsche Gesellschaft f\xc3\xbcr Ausw\xc3\xa4rtige Politik \xe2\x80\x93 German Council on Foreign Relations. Think Tank und Netzwerk f\xc3\xbcr Au\xc3\x9fenpolitik,Berlin
2251,RT @MariaTeresa1: Latinas winning &amp; making history:\n\nHeading to Governorship \n@RepLujanGrisham \n\nHeading To Congress:\n@Ocasio2018 \n@vgescob\xe2\x80\xa6,\xf0\x9f\x87\xba\xf0\x9f\x87\xb8DEMOCRATIC HOUSE 2018\xf0\x9f\x87\xba\xf0\x9f\x87\xb8 #Senate/WH2020,16179017,Mom/Feminist/Proud Immigrant/Climate Change is NOT a hoax/Humanitarian\xf0\x9f\x91\x8fTaking Our Country back \xf0\x9f\x87\xba\xf0\x9f\x87\xb8AMERICA belongs to WE THE PEOPLE \xf0\x9f\xa4\xba\xe2\x98\x94\xef\xb8\x8fRESIST \xf0\x9f\x99\x8f#NoRA,"\xe2\x9d\xa4\xef\xb8\x8fin NY, USA, PLANET \xf0\x9f\x8c\x8e "
2252,"RT @amberlym: \xe2\x80\x9cA mass rejection of corruption, hatred, and bigotry should not be so hard to achieve, but historically it always has been an\xe2\x80\xa6",Carole Meikle,2888236025,,
2253,"Rally a Wall Steet con #midterm:\xc2\xa0#dow Jones\xc2\xa0+1,09%, Nasdaq +1,84% https://t.co/b1ZJcX8gRi",Il Messaggero,36079217,"Il Messaggero, il quotidiano di Roma",Rome
2254,RT @JennaLeeUSA: Why do we even have #Midterm #Elections? Here's the backstory about why the House of Representatives is elected every 2 ye\xe2\x80\xa6,Edie,1046891811720040449,,
2255,RT @SCMPNews: These candidates made history at the 2018 US #midterm elections https://t.co/4f6wYEvvwb #ElectionNight,Tomonari MASADA,5618422,\xe9\x95\xb7\xe5\xb4\x8e\xe5\xa4\xa7\xe5\xad\xa6\xe5\xa4\xa7\xe5\xad\xa6\xe9\x99\xa2\xe5\xb7\xa5\xe5\xad\xa6\xe7\xa0\x94\xe7\xa9\xb6\xe7\xa7\x91\xe6\x83\x85\xe5\xa0\xb1\xe5\xb7\xa5\xe5\xad\xa6\xe3\x82\xb3\xe3\x83\xbc\xe3\x82\xb9\xe5\x87\x86\xe6\x95\x99\xe6\x8e\x88\xe3\x80\x82\xe5\xb0\x82\xe9\x96\x80\xe3\x81\xaf\xe7\xa2\xba\xe7\x8e\x87\xe3\x83\xa2\xe3\x83\x87\xe3\x83\xab\xe3\x81\xab\xe3\x82\x88\xe3\x82\x8b\xe3\x83\x86\xe3\x82\xad\xe3\x82\xb9\xe3\x83\x88\xe3\x83\x9e\xe3\x82\xa4\xe3\x83\x8b\xe3\x83\xb3\xe3\x82\xb0\xe3\x80\x82KPOP/CPOP addict\xe3\x80\x82\xe3\x83\x84\xe3\x82\xa4\xe3\x83\xbc\xe3\x83\x88\xe3\x81\xaf\xe5\x80\x8b\xe4\xba\xba\xe3\x81\xae\xe8\xa6\x8b\xe8\xa7\xa3\xe3\x80\x82 https://t.co/42GPOkEPzo,"Nagasaki, Japan"
2256,RT @BeeNewsDaily: POTUS post #midterm news conference at 11:30A at the #WhiteHouse. https://t.co/Zi2UuAihqg,BeeNewsDaily,853736260397084674,"BeeNewsDaily provides investigative reporting, in-depth national political coverage, national security news, opinion, sports and more. Post your own news here.","Washington, DC"
2257,POTUS post #midterm news conference at 11:30A at the #WhiteHouse. https://t.co/Zi2UuAihqg,BeeNewsDaily,853736260397084674,"BeeNewsDaily provides investigative reporting, in-depth national political coverage, national security news, opinion, sports and more. Post your own news here.","Washington, DC"
2258,"Last night, @abcnews came to #TimesSquare to bring the #midterm elections into focus while providing real-time upda\xe2\x80\xa6 https://t.co/KVAjXaorKu",BrandedCities,252675736,Branded Cities is an Out of Home media company that owns spectacular signs in iconic locations.  To Learn more visit http://t.co/gqmdsXDAjP,"Phoenix, Arizona"
2259,RT @nizmycuba: No surprise Dem Party\xe2\x80\x99s been the real Racist Party: \n\xe2\x80\x9cI know they all look alike\xe2\x80\x9d HRC jokes ornery abt blacks &amp; MSM finds it\xe2\x80\xa6,Bummed SportsFan,912480437154574338,Entertainment Gaming Movies Sports UFC MLB MMA Games,"New York, USA"
2260,Some hiccups at Valley polls highlight otherwise smooth #midterm #election https://t.co/4Q6jfX9Bf0,Fresno Bee,8249832,The No. 1 source of news in California's central San Joaquin Valley.,"Fresno, California"
2261,What makes this years #midterm election stand out from years past? https://t.co/fEN7nYgCHi https://t.co/a5DjBfYh8r,RESI of Towson Univ.,114850514,RESI is @TUInnovates & @TowsonU economic research & policy analysis team & trusted experts on MD economy. Chief Economist @DaraiusIrani  https://t.co/w5fRDa8aTN,"Towson, MD"
2262,These candidates made history at the 2018 US #midterm elections https://t.co/4f6wYEvvwb #ElectionNight,SCMP News,23922797,"South China Morning Post provides news and analysis on Hong Kong, China and the rest of Asia.",Hong Kong
2263,@dilfisland We talked about this when this piece first ran at the beginning of the #midterm season. I explained tha\xe2\x80\xa6 https://t.co/GVGh3Nc9ZY,Morgan Radford,80043764,@NBCnews Correspondent: @TODAYShow/@NBCNightlyNews/@MSNBC. @Harvard Grad. Southern Girl. @FulbrightPrgrm @ColumbiaJourn alumna. Retweets not endorsements.,NYC
2264,The #midterm elections: Here's the verdict on what they mean for #Medicare #Medicaid #SocialSecurity and\xe2\x80\xa6 https://t.co/GRaIjayBgH,Richard Eisenberg,38166684,Managing Editor/Money and Work editor and blogger for @NextAvenue -- a @PBS site for anyone 50+. reisenberg@nextavenue.org,New Jersey
2265,#Stocks advance as #midterm election results roll in https://t.co/IRQVMzni5r https://t.co/qopB1bgUSx,Lake Ave Financial,1602854334,A Financial Partner you can Trust. #Fiduciary #RIA #FinancialPlanning #investments #Pasadena #LakeAve Disclosures: https://t.co/cvWGyaxAbc,"Pasadena, CA"
